{
  "format": "authmatrix-vectors",
  "formatVersion": "1.0.0",
  "generator": {
    "tool": "authmatrix-core scripts/gen-vectors.ts",
    "version": "0.1.0",
    "sdk": "@stellar/stellar-sdk@17.2.1",
    "note": "Canonical values come from the SDK's official helpers; the Rust adapter and the Soroban host independently confirm them (see README)."
  },
  "vectors": [
    {
      "id": "v2-nested-relay-testnet",
      "title": "ADDRESS_V2: outer.relay requires auth, nested inner.transfer requires auth (testnet passphrase)",
      "labels": [
        "fixture-contracts",
        "host-verifiable"
      ],
      "signer": {
        "publicKey": "GAGCWJVDANC44KKHZQ2AHLZELZOCINJME2BB4WI257P4LM7WC6OOGQ4N",
        "derivation": {
          "scheme": "sha256-of-utf8-phrase",
          "phrase": "authmatrix test vector signer 1: public test phrase, key has no value",
          "note": "Seed = SHA-256(UTF-8 phrase). Public, test-only key; it protects nothing and must never hold value on any network."
        }
      },
      "authorization": {
        "address": "GAGCWJVDANC44KKHZQ2AHLZELZOCINJME2BB4WI257P4LM7WC6OOGQ4N",
        "credentialType": "addressV2",
        "networkPassphrase": "Test SDF Network ; September 2015",
        "nonce": "7316487300985",
        "signatureExpirationLedger": 1000,
        "rootInvocation": {
          "contractId": "CBB6ZGAOBKSY4X5DCPJTFARFMUKGBLQQWWRF3Q3PXJUBSNEYLHMY2DFR",
          "functionName": "relay",
          "args": [
            "AAAAEgAAAAFm9j3+ot8yOSILyT1ausSikA/vlQUNle6awzUL4lepyw==",
            "AAAAEgAAAAAAAAAADCsmowNFzilHzDQDryReXCQ1LCaCHlka79/Fs/YXnOM=",
            "AAAAEgAAAAAAAAAAClPn2ac0/BwTRpcH3fq10MqyJknjETQcu3P5hUkNDcY=",
            "AAAACgAAAAAAAAAAAAAAAukO3QA="
          ],
          "subInvocations": [
            {
              "contractId": "CBTPMPP6ULPTEOJCBPET2WV2YSRJAD7PSUCQ3FPOTLBTKC7CK6U4XS7R",
              "functionName": "transfer",
              "args": [
                "AAAAEgAAAAAAAAAADCsmowNFzilHzDQDryReXCQ1LCaCHlka79/Fs/YXnOM=",
                "AAAAEgAAAAAAAAAAClPn2ac0/BwTRpcH3fq10MqyJknjETQcu3P5hUkNDcY=",
                "AAAACgAAAAAAAAAAAAAAAukO3QA="
              ],
              "subInvocations": []
            }
          ]
        }
      },
      "expected": {
        "preimageType": "envelopeTypeSorobanAuthorizationWithAddress",
        "preimageXdr": "AAAACs7gMC1ZhE0yvcqRXIID3USzP7t+3BkFHqN6vt8o7NRyAAAGp4CgZ3kAAAPoAAAAAAAAAAAMKyajA0XOKUfMNAOvJF5cJDUsJoIeWRrv38Wz9hec4wAAAAAAAAABQ+yYDgqljl+jE9MygiVlFGCuELWiXcNvumgZNJhZ2Y0AAAAFcmVsYXkAAAAAAAAEAAAAEgAAAAFm9j3+ot8yOSILyT1ausSikA/vlQUNle6awzUL4lepywAAABIAAAAAAAAAAAwrJqMDRc4pR8w0A68kXlwkNSwmgh5ZGu/fxbP2F5zjAAAAEgAAAAAAAAAAClPn2ac0/BwTRpcH3fq10MqyJknjETQcu3P5hUkNDcYAAAAKAAAAAAAAAAAAAAAC6Q7dAAAAAAEAAAAAAAAAAWb2Pf6i3zI5IgvJPVq6xKKQD++VBQ2V7prDNQviV6nLAAAACHRyYW5zZmVyAAAAAwAAABIAAAAAAAAAAAwrJqMDRc4pR8w0A68kXlwkNSwmgh5ZGu/fxbP2F5zjAAAAEgAAAAAAAAAAClPn2ac0/BwTRpcH3fq10MqyJknjETQcu3P5hUkNDcYAAAAKAAAAAAAAAAAAAAAC6Q7dAAAAAAA=",
        "payloadHashHex": "f524a7f5665853146bb4c36185c09dc16565f8b46af2aea1087b42c10d5ff5e8",
        "signatureHex": "0d75480be22ea16704c9e06584ca5cc47dec58725b61b98443a42bf7095bd5923bb491b8fb04b6510468bea0d795a4109553ded4fbece809ae51a05827d3ff0f",
        "unsignedEntryXdr": "AAAAAgAAAAAAAAAADCsmowNFzilHzDQDryReXCQ1LCaCHlka79/Fs/YXnOMAAAangKBneQAAAAAAAAAQAAAAAQAAAAAAAAAAAAAAAUPsmA4KpY5foxPTMoIlZRRgrhC1ol3Db7poGTSYWdmNAAAABXJlbGF5AAAAAAAABAAAABIAAAABZvY9/qLfMjkiC8k9WrrEopAP75UFDZXumsM1C+JXqcsAAAASAAAAAAAAAAAMKyajA0XOKUfMNAOvJF5cJDUsJoIeWRrv38Wz9hec4wAAABIAAAAAAAAAAApT59mnNPwcE0aXB936tdDKsiZJ4xE0HLtz+YVJDQ3GAAAACgAAAAAAAAAAAAAAAukO3QAAAAABAAAAAAAAAAFm9j3+ot8yOSILyT1ausSikA/vlQUNle6awzUL4lepywAAAAh0cmFuc2ZlcgAAAAMAAAASAAAAAAAAAAAMKyajA0XOKUfMNAOvJF5cJDUsJoIeWRrv38Wz9hec4wAAABIAAAAAAAAAAApT59mnNPwcE0aXB936tdDKsiZJ4xE0HLtz+YVJDQ3GAAAACgAAAAAAAAAAAAAAAukO3QAAAAAA",
        "signedEntryXdr": "AAAAAgAAAAAAAAAADCsmowNFzilHzDQDryReXCQ1LCaCHlka79/Fs/YXnOMAAAangKBneQAAA+gAAAAQAAAAAQAAAAEAAAARAAAAAQAAAAIAAAAPAAAACnB1YmxpY19rZXkAAAAAAA0AAAAgDCsmowNFzilHzDQDryReXCQ1LCaCHlka79/Fs/YXnOMAAAAPAAAACXNpZ25hdHVyZQAAAAAAAA0AAABADXVIC+IuoWcEyeBlhMpcxH3sWHJbYbmEQ6Qr9wlb1ZI7tJG4+wS2UQRovqDXlaQQlVPe1Pvs6AmuUaBYJ9P/DwAAAAAAAAABQ+yYDgqljl+jE9MygiVlFGCuELWiXcNvumgZNJhZ2Y0AAAAFcmVsYXkAAAAAAAAEAAAAEgAAAAFm9j3+ot8yOSILyT1ausSikA/vlQUNle6awzUL4lepywAAABIAAAAAAAAAAAwrJqMDRc4pR8w0A68kXlwkNSwmgh5ZGu/fxbP2F5zjAAAAEgAAAAAAAAAAClPn2ac0/BwTRpcH3fq10MqyJknjETQcu3P5hUkNDcYAAAAKAAAAAAAAAAAAAAAC6Q7dAAAAAAEAAAAAAAAAAWb2Pf6i3zI5IgvJPVq6xKKQD++VBQ2V7prDNQviV6nLAAAACHRyYW5zZmVyAAAAAwAAABIAAAAAAAAAAAwrJqMDRc4pR8w0A68kXlwkNSwmgh5ZGu/fxbP2F5zjAAAAEgAAAAAAAAAAClPn2ac0/BwTRpcH3fq10MqyJknjETQcu3P5hUkNDcYAAAAKAAAAAAAAAAAAAAAC6Q7dAAAAAAA="
      },
      "compatibility": {
        "protocol": {
          "min": 27,
          "max": null
        },
        "status": "current",
        "note": "CAP-71 credential type, introduced in Protocol 27; testnet reports Protocol 29 at recording time (see hostVerified).",
        "hostVerified": [
          {
            "environment": "native-testutils",
            "protocolVersion": 28,
            "evidence": "evidence/native-host/results.json",
            "original": "accepted",
            "mutationsRejected": [
              "recipient",
              "amount",
              "network",
              "nonce",
              "expiry",
              "function",
              "contractId"
            ]
          },
          {
            "environment": "testnet-simulate-enforce",
            "protocolVersion": 29,
            "evidence": "evidence/testnet/summary.json",
            "original": "accepted",
            "mutationsRejected": [
              "recipient",
              "amount",
              "network",
              "nonce",
              "expiry",
              "function",
              "contractId"
            ]
          }
        ]
      },
      "mutations": [
        {
          "id": "v2-nested-relay-testnet--recipient",
          "field": "recipient",
          "description": "recipient address replaced everywhere it appears in the invocation tree",
          "changedPaths": [
            "rootInvocation.args[2]",
            "rootInvocation.subInvocations[0].args[1]"
          ],
          "mutatedAuthorization": {
            "address": "GAGCWJVDANC44KKHZQ2AHLZELZOCINJME2BB4WI257P4LM7WC6OOGQ4N",
            "credentialType": "addressV2",
            "networkPassphrase": "Test SDF Network ; September 2015",
            "nonce": "7316487300985",
            "signatureExpirationLedger": 1000,
            "rootInvocation": {
              "contractId": "CBB6ZGAOBKSY4X5DCPJTFARFMUKGBLQQWWRF3Q3PXJUBSNEYLHMY2DFR",
              "functionName": "relay",
              "args": [
                "AAAAEgAAAAFm9j3+ot8yOSILyT1ausSikA/vlQUNle6awzUL4lepyw==",
                "AAAAEgAAAAAAAAAADCsmowNFzilHzDQDryReXCQ1LCaCHlka79/Fs/YXnOM=",
                "AAAAEgAAAAAAAAAAq43XkLwOrbmsnuF0yyyzSqvAy5lioFDVZ9oCCLGc2Cw=",
                "AAAACgAAAAAAAAAAAAAAAukO3QA="
              ],
              "subInvocations": [
                {
                  "contractId": "CBTPMPP6ULPTEOJCBPET2WV2YSRJAD7PSUCQ3FPOTLBTKC7CK6U4XS7R",
                  "functionName": "transfer",
                  "args": [
                    "AAAAEgAAAAAAAAAADCsmowNFzilHzDQDryReXCQ1LCaCHlka79/Fs/YXnOM=",
                    "AAAAEgAAAAAAAAAAq43XkLwOrbmsnuF0yyyzSqvAy5lioFDVZ9oCCLGc2Cw=",
                    "AAAACgAAAAAAAAAAAAAAAukO3QA="
                  ],
                  "subInvocations": []
                }
              ]
            }
          },
          "expected": {
            "payloadHashChanged": true,
            "mutatedPreimageXdr": "AAAACs7gMC1ZhE0yvcqRXIID3USzP7t+3BkFHqN6vt8o7NRyAAAGp4CgZ3kAAAPoAAAAAAAAAAAMKyajA0XOKUfMNAOvJF5cJDUsJoIeWRrv38Wz9hec4wAAAAAAAAABQ+yYDgqljl+jE9MygiVlFGCuELWiXcNvumgZNJhZ2Y0AAAAFcmVsYXkAAAAAAAAEAAAAEgAAAAFm9j3+ot8yOSILyT1ausSikA/vlQUNle6awzUL4lepywAAABIAAAAAAAAAAAwrJqMDRc4pR8w0A68kXlwkNSwmgh5ZGu/fxbP2F5zjAAAAEgAAAAAAAAAAq43XkLwOrbmsnuF0yyyzSqvAy5lioFDVZ9oCCLGc2CwAAAAKAAAAAAAAAAAAAAAC6Q7dAAAAAAEAAAAAAAAAAWb2Pf6i3zI5IgvJPVq6xKKQD++VBQ2V7prDNQviV6nLAAAACHRyYW5zZmVyAAAAAwAAABIAAAAAAAAAAAwrJqMDRc4pR8w0A68kXlwkNSwmgh5ZGu/fxbP2F5zjAAAAEgAAAAAAAAAAq43XkLwOrbmsnuF0yyyzSqvAy5lioFDVZ9oCCLGc2CwAAAAKAAAAAAAAAAAAAAAC6Q7dAAAAAAA=",
            "mutatedPayloadHashHex": "9effc8239cc77510572f014b81731ddf95da0f1452527a06e220dddfeb5c8cf4",
            "originalSignatureVerifies": false,
            "entryXdrWithOriginalSignature": "AAAAAgAAAAAAAAAADCsmowNFzilHzDQDryReXCQ1LCaCHlka79/Fs/YXnOMAAAangKBneQAAA+gAAAAQAAAAAQAAAAEAAAARAAAAAQAAAAIAAAAPAAAACnB1YmxpY19rZXkAAAAAAA0AAAAgDCsmowNFzilHzDQDryReXCQ1LCaCHlka79/Fs/YXnOMAAAAPAAAACXNpZ25hdHVyZQAAAAAAAA0AAABADXVIC+IuoWcEyeBlhMpcxH3sWHJbYbmEQ6Qr9wlb1ZI7tJG4+wS2UQRovqDXlaQQlVPe1Pvs6AmuUaBYJ9P/DwAAAAAAAAABQ+yYDgqljl+jE9MygiVlFGCuELWiXcNvumgZNJhZ2Y0AAAAFcmVsYXkAAAAAAAAEAAAAEgAAAAFm9j3+ot8yOSILyT1ausSikA/vlQUNle6awzUL4lepywAAABIAAAAAAAAAAAwrJqMDRc4pR8w0A68kXlwkNSwmgh5ZGu/fxbP2F5zjAAAAEgAAAAAAAAAAq43XkLwOrbmsnuF0yyyzSqvAy5lioFDVZ9oCCLGc2CwAAAAKAAAAAAAAAAAAAAAC6Q7dAAAAAAEAAAAAAAAAAWb2Pf6i3zI5IgvJPVq6xKKQD++VBQ2V7prDNQviV6nLAAAACHRyYW5zZmVyAAAAAwAAABIAAAAAAAAAAAwrJqMDRc4pR8w0A68kXlwkNSwmgh5ZGu/fxbP2F5zjAAAAEgAAAAAAAAAAq43XkLwOrbmsnuF0yyyzSqvAy5lioFDVZ9oCCLGc2CwAAAAKAAAAAAAAAAAAAAAC6Q7dAAAAAAA=",
            "hostExpectation": "reject",